[
  { "appareil_id": "CAPT-001", "timestamp": "2026-03-14T06:00:00Z", "type": "vitesse_vent", "valeur": 18.3, "unite": "noeuds", "alerte": false },
  { "appareil_id": "CAPT-001", "timestamp": "2026-03-14T12:00:00Z", "type": "vitesse_vent", "valeur": 25.7, "unite": "noeuds", "alerte": false },
  { "appareil_id": "CAPT-001", "timestamp": "2026-03-15T06:00:00Z", "type": "vitesse_vent", "valeur": 42.1, "unite": "noeuds", "alerte": true },
  { "appareil_id": "CAPT-001", "timestamp": "2026-03-15T18:00:00Z", "type": "vitesse_vent", "valeur": 31.5, "unite": "noeuds", "alerte": false },
  { "appareil_id": "CAPT-001", "timestamp": "2026-03-16T08:00:00Z", "type": "vitesse_vent", "valeur": 55.2, "unite": "noeuds", "alerte": true },
  { "appareil_id": "CAPT-001", "timestamp": "2026-03-17T10:00:00Z", "type": "vitesse_vent", "valeur": 12.8, "unite": "noeuds", "alerte": false },
  { "appareil_id": "CAPT-002", "timestamp": "2026-03-14T06:30:00Z", "type": "temperature_eau", "valeur": 14.2, "unite": "celsius", "alerte": false },
  { "appareil_id": "CAPT-002", "timestamp": "2026-03-15T06:30:00Z", "type": "temperature_eau", "valeur": 13.8, "unite": "celsius", "alerte": false },
  { "appareil_id": "CAPT-002", "timestamp": "2026-03-16T06:30:00Z", "type": "temperature_eau", "valeur": 26.1, "unite": "celsius", "alerte": true },
  { "appareil_id": "CAPT-002", "timestamp": "2026-03-17T06:30:00Z", "type": "temperature_eau", "valeur": 15.0, "unite": "celsius", "alerte": false },
  { "appareil_id": "CAPT-002", "timestamp": "2026-03-18T06:30:00Z", "type": "temperature_eau", "valeur": 14.5, "unite": "celsius", "alerte": false },
  { "appareil_id": "CAPT-003", "timestamp": "2026-03-14T07:00:00Z", "type": "vitesse_gps", "valeur": 6.2, "unite": "noeuds", "alerte": false },
  { "appareil_id": "CAPT-003", "timestamp": "2026-03-15T07:00:00Z", "type": "vitesse_gps", "valeur": 8.1, "unite": "noeuds", "alerte": false },
  { "appareil_id": "CAPT-003", "timestamp": "2026-03-16T07:00:00Z", "type": "vitesse_gps", "valeur": 4.5, "unite": "noeuds", "alerte": false },
  { "appareil_id": "CAPT-003", "timestamp": "2026-03-17T07:00:00Z", "type": "vitesse_gps", "valeur": 7.3, "unite": "noeuds", "alerte": false },
  { "appareil_id": "CAPT-003", "timestamp": "2026-03-18T07:00:00Z", "type": "vitesse_gps", "valeur": 5.9, "unite": "noeuds", "alerte": false },
  { "appareil_id": "CAPT-004", "timestamp": "2026-03-14T08:00:00Z", "type": "vitesse_vent", "valeur": 22.4, "unite": "noeuds", "alerte": false },
  { "appareil_id": "CAPT-004", "timestamp": "2026-03-14T20:00:00Z", "type": "vitesse_vent", "valeur": 37.8, "unite": "noeuds", "alerte": true },
  { "appareil_id": "CAPT-004", "timestamp": "2026-03-15T08:00:00Z", "type": "vitesse_vent", "valeur": 28.9, "unite": "noeuds", "alerte": false },
  { "appareil_id": "CAPT-004", "timestamp": "2026-03-16T14:00:00Z", "type": "vitesse_vent", "valeur": 41.3, "unite": "noeuds", "alerte": true },
  { "appareil_id": "CAPT-004", "timestamp": "2026-03-17T08:00:00Z", "type": "vitesse_vent", "valeur": 15.6, "unite": "noeuds", "alerte": false },
  { "appareil_id": "CAPT-004", "timestamp": "2026-03-18T08:00:00Z", "type": "vitesse_vent", "valeur": 19.2, "unite": "noeuds", "alerte": false },
  { "appareil_id": "CAPT-005", "timestamp": "2026-03-14T08:30:00Z", "type": "temperature_eau", "valeur": 12.1, "unite": "celsius", "alerte": false },
  { "appareil_id": "CAPT-005", "timestamp": "2026-03-15T08:30:00Z", "type": "temperature_eau", "valeur": 11.8, "unite": "celsius", "alerte": false },
  { "appareil_id": "CAPT-005", "timestamp": "2026-03-16T08:30:00Z", "type": "temperature_eau", "valeur": 23.5, "unite": "celsius", "alerte": true },
  { "appareil_id": "CAPT-005", "timestamp": "2026-03-17T08:30:00Z", "type": "temperature_eau", "valeur": 13.2, "unite": "celsius", "alerte": false },
  { "appareil_id": "CAPT-005", "timestamp": "2026-03-18T08:30:00Z", "type": "temperature_eau", "valeur": 12.7, "unite": "celsius", "alerte": false },
  { "appareil_id": "CAPT-006", "timestamp": "2026-03-14T09:00:00Z", "type": "cap", "valeur": 185.0, "unite": "degres", "alerte": false },
  { "appareil_id": "CAPT-006", "timestamp": "2026-03-15T09:00:00Z", "type": "cap", "valeur": 220.5, "unite": "degres", "alerte": false },
  { "appareil_id": "CAPT-006", "timestamp": "2026-03-16T09:00:00Z", "type": "cap", "valeur": 45.0, "unite": "degres", "alerte": false },
  { "appareil_id": "CAPT-006", "timestamp": "2026-03-17T09:00:00Z", "type": "cap", "valeur": 310.2, "unite": "degres", "alerte": false },
  { "appareil_id": "CAPT-006", "timestamp": "2026-03-18T09:00:00Z", "type": "cap", "valeur": 172.8, "unite": "degres", "alerte": false },
  { "appareil_id": "CAPT-007", "timestamp": "2026-03-14T10:00:00Z", "type": "vitesse_vent", "valeur": 28.4, "unite": "noeuds", "alerte": false },
  { "appareil_id": "CAPT-007", "timestamp": "2026-03-15T04:00:00Z", "type": "vitesse_vent", "valeur": 33.7, "unite": "noeuds", "alerte": true },
  { "appareil_id": "CAPT-007", "timestamp": "2026-03-15T16:00:00Z", "type": "vitesse_vent", "valeur": 19.1, "unite": "noeuds", "alerte": false },
  { "appareil_id": "CAPT-007", "timestamp": "2026-03-16T10:00:00Z", "type": "vitesse_vent", "valeur": 45.6, "unite": "noeuds", "alerte": true },
  { "appareil_id": "CAPT-007", "timestamp": "2026-03-17T10:00:00Z", "type": "vitesse_vent", "valeur": 8.3, "unite": "noeuds", "alerte": false },
  { "appareil_id": "CAPT-007", "timestamp": "2026-03-18T10:00:00Z", "type": "vitesse_vent", "valeur": 22.0, "unite": "noeuds", "alerte": false },
  { "appareil_id": "CAPT-008", "timestamp": "2026-03-14T10:30:00Z", "type": "temperature_eau", "valeur": 10.5, "unite": "celsius", "alerte": false },
  { "appareil_id": "CAPT-008", "timestamp": "2026-03-15T10:30:00Z", "type": "temperature_eau", "valeur": 11.2, "unite": "celsius", "alerte": false },
  { "appareil_id": "CAPT-008", "timestamp": "2026-03-16T10:30:00Z", "type": "temperature_eau", "valeur": 29.8, "unite": "celsius", "alerte": true },
  { "appareil_id": "CAPT-008", "timestamp": "2026-03-17T10:30:00Z", "type": "temperature_eau", "valeur": 10.9, "unite": "celsius", "alerte": false },
  { "appareil_id": "CAPT-008", "timestamp": "2026-03-18T10:30:00Z", "type": "temperature_eau", "valeur": 11.0, "unite": "celsius", "alerte": false },
  { "appareil_id": "CAPT-009", "timestamp": "2026-03-14T11:00:00Z", "type": "vitesse_gps", "valeur": 5.4, "unite": "noeuds", "alerte": false },
  { "appareil_id": "CAPT-009", "timestamp": "2026-03-15T11:00:00Z", "type": "vitesse_gps", "valeur": 7.8, "unite": "noeuds", "alerte": false },
  { "appareil_id": "CAPT-009", "timestamp": "2026-03-16T11:00:00Z", "type": "vitesse_gps", "valeur": 3.2, "unite": "noeuds", "alerte": false },
  { "appareil_id": "CAPT-009", "timestamp": "2026-03-17T11:00:00Z", "type": "vitesse_gps", "valeur": 6.5, "unite": "noeuds", "alerte": false },
  { "appareil_id": "CAPT-009", "timestamp": "2026-03-18T11:00:00Z", "type": "vitesse_gps", "valeur": 4.1, "unite": "noeuds", "alerte": false },
  { "appareil_id": "CAPT-010", "timestamp": "2026-03-14T12:00:00Z", "type": "vitesse_vent", "valeur": 32.1, "unite": "noeuds", "alerte": false },
  { "appareil_id": "CAPT-010", "timestamp": "2026-03-15T00:00:00Z", "type": "vitesse_vent", "valeur": 51.4, "unite": "noeuds", "alerte": true },
  { "appareil_id": "CAPT-010", "timestamp": "2026-03-15T12:00:00Z", "type": "vitesse_vent", "valeur": 38.9, "unite": "noeuds", "alerte": false },
  { "appareil_id": "CAPT-010", "timestamp": "2026-03-16T12:00:00Z", "type": "vitesse_vent", "valeur": 47.2, "unite": "noeuds", "alerte": true },
  { "appareil_id": "CAPT-010", "timestamp": "2026-03-17T12:00:00Z", "type": "vitesse_vent", "valeur": 21.0, "unite": "noeuds", "alerte": false },
  { "appareil_id": "CAPT-010", "timestamp": "2026-03-18T12:00:00Z", "type": "vitesse_vent", "valeur": 29.5, "unite": "noeuds", "alerte": false },
  { "appareil_id": "CAPT-011", "timestamp": "2026-03-14T12:30:00Z", "type": "temperature_eau", "valeur": 16.3, "unite": "celsius", "alerte": false },
  { "appareil_id": "CAPT-011", "timestamp": "2026-03-15T12:30:00Z", "type": "temperature_eau", "valeur": 15.8, "unite": "celsius", "alerte": false },
  { "appareil_id": "CAPT-011", "timestamp": "2026-03-16T12:30:00Z", "type": "temperature_eau", "valeur": 31.2, "unite": "celsius", "alerte": true },
  { "appareil_id": "CAPT-011", "timestamp": "2026-03-17T12:30:00Z", "type": "temperature_eau", "valeur": 16.0, "unite": "celsius", "alerte": false },
  { "appareil_id": "CAPT-011", "timestamp": "2026-03-18T12:30:00Z", "type": "temperature_eau", "valeur": 2.1, "unite": "celsius", "alerte": false },
  { "appareil_id": "CAPT-012", "timestamp": "2026-03-14T13:00:00Z", "type": "cap", "valeur": 90.0, "unite": "degres", "alerte": false },
  { "appareil_id": "CAPT-012", "timestamp": "2026-03-15T13:00:00Z", "type": "cap", "valeur": 135.5, "unite": "degres", "alerte": false },
  { "appareil_id": "CAPT-012", "timestamp": "2026-03-16T13:00:00Z", "type": "cap", "valeur": 270.0, "unite": "degres", "alerte": false },
  { "appareil_id": "CAPT-012", "timestamp": "2026-03-17T13:00:00Z", "type": "cap", "valeur": 0.5, "unite": "degres", "alerte": false },
  { "appareil_id": "CAPT-012", "timestamp": "2026-03-18T13:00:00Z", "type": "cap", "valeur": 198.3, "unite": "degres", "alerte": false }
]
